{
  "$schema": "./concept.schema.json",
  "schema_version": 1,
  "repository": "mryk814/re-process-dashboard",
  "verified_commit": "c5a8c9a2210fd05b6e6f170cfd274ef48c126ef2",
  "categories": [
    {
      "id": "identity-evidence",
      "title": "IdentityとEvidence"
    },
    {
      "id": "data",
      "title": "Data"
    },
    {
      "id": "model",
      "title": "Model"
    },
    {
      "id": "decision",
      "title": "Decision"
    },
    {
      "id": "architecture",
      "title": "Architecture"
    },
    {
      "id": "ui-testing",
      "title": "UIとTesting"
    }
  ],
  "chapters": [
    {
      "id": "contract-through-stack",
      "title": "型付き契約をPythonからReactまで通す",
      "path": "chapters/contract-through-stack.qmd"
    },
    {
      "id": "extend-contract",
      "title": "演習：契約変更の影響範囲を予測する",
      "path": "labs/extend-contract.qmd"
    },
    {
      "id": "decision-safety",
      "title": "予測と判断のあいだを設計する",
      "path": "chapters/decision-safety.qmd"
    },
    {
      "id": "source-to-training-evidence",
      "title": "Source更新を学習から切り離す",
      "path": "chapters/source-to-training-evidence.qmd"
    },
    {
      "id": "trace-source-evidence",
      "title": "演習：行が学習対象になるまでを追跡する",
      "path": "labs/trace-source-evidence.qmd"
    },
    {
      "id": "revision-and-digest",
      "title": "順番と内容を別々に識別する",
      "path": "chapters/revision-and-digest.qmd"
    },
    {
      "id": "trace-revision-conflict",
      "title": "演習：二つの順番と遅いresponseを判定する",
      "path": "labs/trace-revision-conflict.qmd"
    },
    {
      "id": "trust-a-migrated-database",
      "title": "過去のDBを現在の契約で信用する",
      "path": "chapters/trust-a-migrated-database.qmd"
    },
    {
      "id": "break-and-repair-migration",
      "title": "演習：migrationの矛盾を再現して診断する",
      "path": "labs/break-and-repair-migration.qmd"
    },
    {
      "id": "separate-archive-from-purge",
      "title": "一覧から外すことと証拠を消すことを分ける",
      "path": "chapters/separate-archive-from-purge.qmd"
    },
    {
      "id": "trace-project-lifecycle",
      "title": "演習：Projectの証拠を残したまま作業を終える",
      "path": "labs/trace-project-lifecycle.qmd"
    },
    {
      "id": "restore-workspace-safely",
      "title": "Workspaceを切り替える前に復元を確かめる",
      "path": "chapters/restore-workspace-safely.qmd"
    },
    {
      "id": "trace-workspace-restore",
      "title": "演習：復元途中のWorkspaceを診断する",
      "path": "labs/trace-workspace-restore.qmd"
    }
  ],
  "concepts": [
    {
      "id": "logical-identity",
      "term_ja": "論理identity",
      "term_en": "logical identity",
      "aliases": [
        "logical ID"
      ],
      "category": "identity-evidence",
      "scope": "repo-wide",
      "status": "current",
      "status_note": null,
      "definition": "変更版をまたいで同じ継続対象を指す識別子で、Candidateでは`id`が担います。",
      "anti_definitions": [
        "内容が同じであることを示すdigestではありません。"
      ],
      "not_same_as": [
        "semantic-digest",
        "revision"
      ],
      "prerequisites": [],
      "related": [
        "snapshot"
      ],
      "math_connections": [],
      "repo_references": [
        {
          "path": "backend/src/material_workbench/contracts/schemas.py",
          "role": "contract"
        }
      ],
      "common_misconceptions": []
    },
    {
      "id": "revision",
      "term_ja": "リビジョン",
      "term_en": "revision",
      "aliases": [
        "Candidate revision"
      ],
      "category": "identity-evidence",
      "scope": "repo-wide",
      "status": "current",
      "status_note": null,
      "definition": "同じ論理対象について受理された変更の順番で、Candidateでは保存競合の検出と過去版参照に使います。",
      "anti_definitions": [
        "内容が同じであることを示すhashではありません。"
      ],
      "not_same_as": [
        "logical-identity",
        "semantic-digest"
      ],
      "prerequisites": [
        "logical-identity"
      ],
      "related": [
        "optimistic-concurrency"
      ],
      "math_connections": [
        "単調増加する整数として順序だけを表し、距離や内容差を表しません"
      ],
      "repo_references": [
        {
          "path": "backend/src/material_workbench/contracts/schemas.py",
          "role": "contract"
        }
      ],
      "common_misconceptions": [
        "revision値が大きいほど内容が良い、という尺度ではありません。"
      ]
    },
    {
      "id": "semantic-digest",
      "term_ja": "意味表現digest",
      "term_en": "semantic digest",
      "aliases": [
        "content identity"
      ],
      "category": "identity-evidence",
      "scope": "repo-wide",
      "status": "current",
      "status_note": null,
      "definition": "callerが契約で選んだfieldを決定的に正規化して計算する内容identityです。",
      "anti_definitions": [
        "科学的意味の同値性を自動証明する値ではありません。"
      ],
      "not_same_as": [
        "byte-digest",
        "revision"
      ],
      "prerequisites": [
        "contract"
      ],
      "related": [
        "binding-provenance"
      ],
      "math_connections": [
        "同じcanonical byte列へ同じhash関数を適用したときに同じ値になります"
      ],
      "repo_references": [
        {
          "path": "backend/src/material_workbench/execution/inference_work_graph.py",
          "role": "domain"
        }
      ],
      "common_misconceptions": [
        "pathや表示名を含めるかはhash関数ではなくcallerの契約が決めます。"
      ]
    },
    {
      "id": "byte-digest",
      "term_ja": "byte digest",
      "term_en": "byte digest",
      "aliases": [
        "SHA-256"
      ],
      "category": "identity-evidence",
      "scope": "repo-wide",
      "status": "current",
      "status_note": null,
      "definition": "Sourceまたはartifactの実際のbyte列へSHA-256を適用し、破損と取り違えを検出する値です。",
      "anti_definitions": [
        "artifact提供者の真正性を認証する署名ではありません。"
      ],
      "not_same_as": [
        "semantic-digest"
      ],
      "prerequisites": [],
      "related": [
        "workspace-bundle"
      ],
      "math_connections": [
        "入力byte列が一bitでも変われば別値になることを期待する暗号学的hashです"
      ],
      "repo_references": [
        {
          "path": "backend/src/material_workbench/modeling/model_packages.py",
          "role": "application"
        }
      ],
      "common_misconceptions": []
    },
    {
      "id": "immutable-evidence",
      "term_ja": "不変な判断証拠",
      "term_en": "immutable evidence",
      "aliases": [
        "saved evidence"
      ],
      "category": "identity-evidence",
      "scope": "repo-wide",
      "status": "current",
      "status_note": null,
      "definition": "保存後に最新状態で上書きせず、実行時の入力identity、契約、結果を一組として残すSnapshotやRunです。",
      "anti_definitions": [
        "最新Packageで自動再計算されるcacheではありません。"
      ],
      "not_same_as": [
        "server-state"
      ],
      "prerequisites": [
        "snapshot",
        "provenance"
      ],
      "related": [
        "project-archive"
      ],
      "math_connections": [],
      "repo_references": [
        {
          "path": "backend/src/material_workbench/persistence/store.py",
          "role": "persistence"
        }
      ],
      "common_misconceptions": []
    },
    {
      "id": "snapshot",
      "term_ja": "スナップショット",
      "term_en": "snapshot",
      "aliases": [
        "Prediction Snapshot"
      ],
      "category": "identity-evidence",
      "scope": "repo-wide",
      "status": "current",
      "status_note": null,
      "definition": "特定Candidate revisionに対する予測とモデルidentityを固定し、後のPackage変更でも再計算しない保存recordです。",
      "anti_definitions": [
        "現在の入力を再評価する一時cacheではありません。"
      ],
      "not_same_as": [
        "server-state"
      ],
      "prerequisites": [
        "revision",
        "provenance"
      ],
      "related": [
        "training-snapshot"
      ],
      "math_connections": [],
      "repo_references": [
        {
          "path": "backend/src/material_workbench/contracts/schemas.py",
          "role": "contract"
        }
      ],
      "common_misconceptions": []
    },
    {
      "id": "provenance",
      "term_ja": "来歴",
      "term_en": "provenance",
      "aliases": [
        "lineage"
      ],
      "category": "identity-evidence",
      "scope": "repo-wide",
      "status": "current",
      "status_note": null,
      "definition": "結果を作ったTask、Candidate revision、Model Package、Feature Pipeline、学習データを再特定する情報です。",
      "anti_definitions": [
        "結果が科学的に正しいことの保証ではありません。"
      ],
      "not_same_as": [
        "calibration"
      ],
      "prerequisites": [],
      "related": [
        "immutable-evidence"
      ],
      "math_connections": [],
      "repo_references": [
        {
          "path": "backend/src/material_workbench/contracts/schemas.py",
          "role": "contract"
        }
      ],
      "common_misconceptions": []
    },
    {
      "id": "binding-provenance",
      "term_ja": "結び付け来歴",
      "term_en": "binding provenance",
      "aliases": [],
      "category": "identity-evidence",
      "scope": "subsystem",
      "status": "current",
      "status_note": null,
      "definition": "RunがProjectのどのDesign SpaceまたはObjective revisionとdigestを使ったかを実行時に固定する情報です。",
      "anti_definitions": [],
      "not_same_as": [
        "provenance"
      ],
      "prerequisites": [
        "revision",
        "semantic-digest"
      ],
      "related": [
        "objective-definition"
      ],
      "math_connections": [],
      "repo_references": [
        {
          "path": "backend/src/material_workbench/contracts/proposal_contracts.py",
          "role": "contract"
        }
      ],
      "common_misconceptions": [
        "現在のProject設定を読むだけでは、過去Runが使った設定を再現できません。"
      ]
    },
    {
      "id": "optimistic-concurrency",
      "term_ja": "楽観的並行制御",
      "term_en": "optimistic concurrency",
      "aliases": [
        "compare-and-swap"
      ],
      "category": "identity-evidence",
      "scope": "repo-wide",
      "status": "current",
      "status_note": null,
      "definition": "編集中にlockを保持せず、保存時に`expected_revision`とcurrent revisionを同一UPDATE内で比較してlost updateを拒否する方式です。",
      "anti_definitions": [
        "複数利用者の編集を自動mergeする方式ではありません。"
      ],
      "not_same_as": [
        "request-sequence"
      ],
      "prerequisites": [
        "revision"
      ],